{
  "schemaVersion": 1,
  "packId": "brightquest_class_5",
  "packVersion": "1.0.0",
  "classNumber": 5,
  "locale": "en-IN",
  "commercial": {
    "priceInr": 299,
    "purchaseModel": "oneTimePerClass",
    "paidEligibility": false,
    "freeSampleActivityIds": [
      "c5_coding_maze_c5_code_1",
      "c5_fraction_pizza_f5_1",
      "c5_grammar_puzzle_grammar5_1",
      "c5_map_quest_map5_1",
      "c5_math_market_q01",
      "c5_recycling_challenge_recycle5_1",
      "c5_science_lab_q01",
      "c5_story_builder_story5_1"
    ]
  },
  "development": {
    "lockable": true,
    "defaultLocked": false
  },
  "activities": [
    {
      "id": "c5_math_market_q01",
      "legacyContentId": "q01",
      "classNumber": 5,
      "gameId": "math_market",
      "topicId": "division",
      "subject": "maths",
      "unitId": "c5_math_numbers",
      "competencyId": "c5_math_four_operations",
      "relatedCompetencyIds": [],
      "learningOutcomeId": "c5_math_four_operations_lo1",
      "relatedLearningOutcomeIds": [],
      "activityType": "independentPractice",
      "difficulty": 1,
      "prompt": "144 ÷ 12 = ?",
      "correctResponseRule": {
        "type": "exactNumber",
        "value": 12
      },
      "explanation": "Think: 12 × ? = 144. The correct value is 12.",
      "distractors": [
        {
          "value": 10,
          "misconceptionId": "arithmetic_error_1"
        },
        {
          "value": 11,
          "misconceptionId": "arithmetic_error_2"
        },
        {
          "value": 14,
          "misconceptionId": "arithmetic_error_4"
        }
      ],
      "hints": [
        {
          "step": 1,
          "text": "Think: 12 × ? = 144."
        }
      ],
      "narration": {
        "text": "144 ÷ 12 = ?"
      },
      "locale": "en-IN",
      "author": "brightquest-legacy-migration",
      "reviewerOwnerId": "primary_teacher_reviewer",
      "status": "needsReview",
      "revision": 1,
      "generation": {
        "mode": "authored",
        "deterministicSeed": null
      },
      "payload": {
        "answer": 12,
        "choices": [
          10,
          11,
          12,
          14
        ],
        "hint": "Think: 12 × ? = 144."
      }
    },
    {
      "id": "c5_math_market_q02",
      "legacyContentId": "q02",
      "classNumber": 5,
      "gameId": "math_market",
      "topicId": "addition",
      "subject": "maths",
      "unitId": "c5_math_numbers",
      "competencyId": "c5_math_four_operations",
      "relatedCompetencyIds": [],
      "learningOutcomeId": "c5_math_four_operations_lo1",
      "relatedLearningOutcomeIds": [],
      "activityType": "independentPractice",
      "difficulty": 1,
      "prompt": "375 + 248 = ?",
      "correctResponseRule": {
        "type": "exactNumber",
        "value": 623
      },
      "explanation": "Add by place value. The correct value is 623.",
      "distractors": [
        {
          "value": 613,
          "misconceptionId": "arithmetic_error_1"
        },
        {
          "value": 633,
          "misconceptionId": "arithmetic_error_3"
        },
        {
          "value": 643,
          "misconceptionId": "arithmetic_error_4"
        }
      ],
      "hints": [
        {
          "step": 1,
          "text": "Add by place value."
        }
      ],
      "narration": {
        "text": "375 + 248 = ?"
      },
      "locale": "en-IN",
      "author": "brightquest-legacy-migration",
      "reviewerOwnerId": "primary_teacher_reviewer",
      "status": "needsReview",
      "revision": 1,
      "generation": {
        "mode": "authored",
        "deterministicSeed": null
      },
      "payload": {
        "answer": 623,
        "choices": [
          613,
          623,
          633,
          643
        ],
        "hint": "Add by place value."
      }
    },
    {
      "id": "c5_math_market_q03",
      "legacyContentId": "q03",
      "classNumber": 5,
      "gameId": "math_market",
      "topicId": "subtraction",
      "subject": "maths",
      "unitId": "c5_math_numbers",
      "competencyId": "c5_math_four_operations",
      "relatedCompetencyIds": [],
      "learningOutcomeId": "c5_math_four_operations_lo1",
      "relatedLearningOutcomeIds": [],
      "activityType": "independentPractice",
      "difficulty": 1,
      "prompt": "900 - 457 = ?",
      "correctResponseRule": {
        "type": "exactNumber",
        "value": 443
      },
      "explanation": "Regroup across the zeros. The correct value is 443.",
      "distractors": [
        {
          "value": 433,
          "misconceptionId": "arithmetic_error_1"
        },
        {
          "value": 453,
          "misconceptionId": "arithmetic_error_3"
        },
        {
          "value": 463,
          "misconceptionId": "arithmetic_error_4"
        }
      ],
      "hints": [
        {
          "step": 1,
          "text": "Regroup across the zeros."
        }
      ],
      "narration": {
        "text": "900 - 457 = ?"
      },
      "locale": "en-IN",
      "author": "brightquest-legacy-migration",
      "reviewerOwnerId": "primary_teacher_reviewer",
      "status": "needsReview",
      "revision": 1,
      "generation": {
        "mode": "authored",
        "deterministicSeed": null
      },
      "payload": {
        "answer": 443,
        "choices": [
          433,
          443,
          453,
          463
        ],
        "hint": "Regroup across the zeros."
      }
    },
    {
      "id": "c5_math_market_q04",
      "legacyContentId": "q04",
      "classNumber": 5,
      "gameId": "math_market",
      "topicId": "multiplication",
      "subject": "maths",
      "unitId": "c5_math_numbers",
      "competencyId": "c5_math_four_operations",
      "relatedCompetencyIds": [],
      "learningOutcomeId": "c5_math_four_operations_lo1",
      "relatedLearningOutcomeIds": [],
      "activityType": "independentPractice",
      "difficulty": 1,
      "prompt": "32 × 10 = ?",
      "correctResponseRule": {
        "type": "exactNumber",
        "value": 320
      },
      "explanation": "Multiplying by 10 shifts the place value. The correct value is 320.",
      "distractors": [
        {
          "value": 32,
          "misconceptionId": "arithmetic_error_1"
        },
        {
          "value": 300,
          "misconceptionId": "arithmetic_error_2"
        },
        {
          "value": 3200,
          "misconceptionId": "arithmetic_error_4"
        }
      ],
      "hints": [
        {
          "step": 1,
          "text": "Multiplying by 10 shifts the place value."
        }
      ],
      "narration": {
        "text": "32 × 10 = ?"
      },
      "locale": "en-IN",
      "author": "brightquest-legacy-migration",
      "reviewerOwnerId": "primary_teacher_reviewer",
      "status": "needsReview",
      "revision": 1,
      "generation": {
        "mode": "authored",
        "deterministicSeed": null
      },
      "payload": {
        "answer": 320,
        "choices": [
          32,
          300,
          320,
          3200
        ],
        "hint": "Multiplying by 10 shifts the place value."
      }
    },
    {
      "id": "c5_math_market_q05",
      "legacyContentId": "q05",
      "classNumber": 5,
      "gameId": "math_market",
      "topicId": "multiplication",
      "subject": "maths",
      "unitId": "c5_math_numbers",
      "competencyId": "c5_math_four_operations",
      "relatedCompetencyIds": [],
      "learningOutcomeId": "c5_math_four_operations_lo1",
      "relatedLearningOutcomeIds": [],
      "activityType": "independentPractice",
      "difficulty": 2,
      "prompt": "25 × 16 = ?",
      "correctResponseRule": {
        "type": "exactNumber",
        "value": 400
      },
      "explanation": "Break 16 into 10 + 6. The correct value is 400.",
      "distractors": [
        {
          "value": 350,
          "misconceptionId": "arithmetic_error_1"
        },
        {
          "value": 375,
          "misconceptionId": "arithmetic_error_2"
        },
        {
          "value": 425,
          "misconceptionId": "arithmetic_error_4"
        }
      ],
      "hints": [
        {
          "step": 1,
          "text": "Break 16 into 10 + 6."
        }
      ],
      "narration": {
        "text": "25 × 16 = ?"
      },
      "locale": "en-IN",
      "author": "brightquest-legacy-migration",
      "reviewerOwnerId": "primary_teacher_reviewer",
      "status": "needsReview",
      "revision": 1,
      "generation": {
        "mode": "authored",
        "deterministicSeed": null
      },
      "payload": {
        "answer": 400,
        "choices": [
          350,
          375,
          400,
          425
        ],
        "hint": "Break 16 into 10 + 6."
      }
    },
    {
      "id": "c5_math_market_q06",
      "legacyContentId": "q06",
      "classNumber": 5,
      "gameId": "math_market",
      "topicId": "division",
      "subject": "maths",
      "unitId": "c5_math_numbers",
      "competencyId": "c5_math_four_operations",
      "relatedCompetencyIds": [],
      "learningOutcomeId": "c5_math_four_operations_lo1",
      "relatedLearningOutcomeIds": [],
      "activityType": "independentPractice",
      "difficulty": 2,
      "prompt": "840 ÷ 7 = ?",
      "correctResponseRule": {
        "type": "exactNumber",
        "value": 120
      },
      "explanation": "84 ÷ 7 = 12, then keep the zero. The correct value is 120.",
      "distractors": [
        {
          "value": 110,
          "misconceptionId": "arithmetic_error_1"
        },
        {
          "value": 130,
          "misconceptionId": "arithmetic_error_3"
        },
        {
          "value": 140,
          "misconceptionId": "arithmetic_error_4"
        }
      ],
      "hints": [
        {
          "step": 1,
          "text": "84 ÷ 7 = 12, then keep the zero."
        }
      ],
      "narration": {
        "text": "840 ÷ 7 = ?"
      },
      "locale": "en-IN",
      "author": "brightquest-legacy-migration",